source,author,title,description,url,urlToImage,publishedAt,content
"{'id': 'globo', 'name': 'Globo'}",,ANP divulga lista de empresas aptas a participar de leilão de partilha em outubro,A lista contém 15 empresas com inscrição ativa e aptas a participar do 3° Ciclo de Oferta Permanente de Partilha de Produção; a sessão ocorrerá no dia 22 de outubro,https://valor.globo.com/brasil/noticia/2025/07/15/anp-divulga-lista-de-empresas-aptas-a-participar-de-leilo-de-partilha-em-outubro.ghtml,https://s2-valor.glbimg.com/-QvvbolxKcNuZQ8GjHbbjMbMJu4=/1200x/smart/filters:cover():strip_icc()/i.s3.glbimg.com/v1/AUTH_63b422c2caee4269b8b34177e8876b93/internal_photos/bs/2020/S/O/HDlrQgTVOAQqUBKK8pYw/xconteudo308.jpg.pagespeed.ic.4-pffqg9jg.jpg,2025-07-15T16:05:58Z,A Agência Nacional de Petróleo e Gás Natural (ANP) divulgou nesta terça-feira (15) a relação das 15 empresas com inscrição ativa e aptas a participar do 3° Ciclo de Oferta Permanente de Partilha de P… [+824 chars]
"{'id': 'info-money', 'name': 'InfoMoney'}",Lara Rizério,"Ibovespa: como temor com China pesa no índice, em dia de reuniões sobre tarifa e IOF","Apesar do crescimento de 5,2% do Produto Interno Bruto (PIB) da China no segundo trimestre ante igual período de 2024, acima do esperado, há preocupações com o ritmo de expansão da economia
The post Ibovespa: como temor com China pesa no índice, em dia de reu…",https://www.infomoney.com.br/mercados/ibovespa-como-temor-com-china-pesa-no-indice-em-dia-de-reunioes-sobre-tarifa-e-iof/,https://www.infomoney.com.br/wp-content/uploads/2019/06/painel-de-acoes.jpg?quality=70,2025-07-15T15:34:02Z,"A alta da maioria dos índices das bolsas em Nova York é insuficiente para estimular o Ibovespa, em meio às incertezas tarifárias, com relação ao impasse do Imposto sobre Operações Financeiras (IOF) e… [+4070 chars]"
"{'id': 'globo', 'name': 'Globo'}",,Ibovespa recua com pesquisas eleitorais no radar,"Investidores também analisam os números do índice de preços ao consumidor (CPI, na sigla em inglês) americano, que trouxe uma leitura mais amena, apesar da guerra comercial desencadeada pelos Estados Unidos",https://valor.globo.com/financas/noticia/2025/07/15/ibovespa-recua-com-pesquisas-eleitorais-no-radar.ghtml,https://s2-valor.glbimg.com/8mGvwmArgYOmwsjJuQ-egs-Sb3s=/1200x/smart/filters:cover():strip_icc()/i.s3.glbimg.com/v1/AUTH_63b422c2caee4269b8b34177e8876b93/internal_photos/bs/2025/q/o/M9BNRrQ2uUOg166j285A/380909641.jpg,2025-07-15T13:42:10Z,O Ibovespa opera em leve queda no início dos negócios desta terça-feira (15). O movimento ocorre após seis pregões seguidos de perdas da principal referência acionária da bolsa local. Investidores ac… [+940 chars]
"{'id': 'info-money', 'name': 'InfoMoney'}",Rodrigo Paz,Mini-índice (WINQ25): mercado aguarda balanço das empresas no 2T25 em busca de tração,"O que esperar para o mini-índice hoje
The post Mini-índice (WINQ25): mercado aguarda balanço das empresas no 2T25 em busca de tração appeared first on InfoMoney.",https://www.infomoney.com.br/mercados/mini-indice-hoje-futuro-ibovespa-winq25-15072025/,https://www.infomoney.com.br/wp-content/uploads/2025/07/WINQ25-15-MINUTOS-15.07.2025.png?quality=70,2025-07-15T10:36:27Z,"Em mais um pregão influenciado pelas incertezas globais, o Ibovespa acumulou a sexta queda consecutiva nesta segunda-feira (14), encerrando o dia com recuo de 0,66%, aos 135.290 pontos. O tom negativ… [+3806 chars]"
"{'id': None, 'name': 'Uol.com.br'}",,,"Órgão ambiental pede ações contra mudança do clima em nova etapa do pré-sal, no maior projeto da história do país; Petrobras vê tratamento discriminatório",https://www1.folha.uol.com.br/ambiente/2025/07/ibama-ve-resistencia-da-petrobras-em-plano-climatico-e-segura-licenca-de-r-1964-bilhoes.shtml,https://f.i.uol.com.br/fotografia/2025/07/14/175253518668759092c638f_1752535186_3x2_rt.jpg,2025-07-15T09:50:43Z,"O maior projeto de licenciamento ambiental da história do Brasil, iniciativa que receberá investimentos de R$ 196,4 bilhões, converteu-se em um novo flanco de desentendimentos entre o Ibama (Institut… [+5882 chars]"
